{
  "$schema": "https://json-schema.org/draft/2020-12/schema",
  "$id": "https://besttimetohike.com/schemas/destination.schema.json",
  "type": "object",
  "required": ["schemaVersion","algorithmVersion","aggregationPolicyVersion","datasetStatus","id","slug","name","countryCode","countryName","continent","region","timezone","tags","coordinates","elevationBands","elevation","months","recommendationEligible","representativeCell","historicalPeriod","bestMonths","alternatives","provenance","updatedAt"],
  "properties": {
    "schemaVersion": {"const": 1},
    "algorithmVersion": {"type":"string","pattern":"^[0-9]+\\.[0-9]+\\.[0-9]+$"},
    "aggregationPolicyVersion":{"enum":["legacy-climate-aggregation-v1","observation-validity-v1"]},
    "datasetStatus": {"enum":["fixture","provisional","production"]},
    "id": {"$ref":"#/$defs/slug"}, "slug": {"$ref":"#/$defs/slug"}, "name": {"type":"string","minLength":1},
    "countryCode": {"type":"string","pattern":"^[A-Z]{2}$"}, "countryName": {"type":"string","minLength":1},
    "continent": {"$ref":"#/$defs/slug"}, "region": {"$ref":"#/$defs/slug"}, "timezone": {"type":"string","minLength":3},
    "tags": {"type":"array","items":{"$ref":"#/$defs/slug"},"uniqueItems":true},
    "coordinates": {"type":"object","required":["lat","lon"],"properties":{"lat":{"type":"number","minimum":-90,"maximum":90},"lon":{"type":"number","minimum":-180,"maximum":180}},"additionalProperties":false},
    "elevationBands": {"type":"array","minItems":1,"items":{"$ref":"#/$defs/elevationBand"}},
    "elevation": {"type":"object","required":["minM","medianM","maxM"],"properties":{"minM":{"type":"number"},"medianM":{"type":"number"},"maxM":{"type":"number"}},"additionalProperties":false},
    "months": {"type":"array","minItems":12,"maxItems":12,"items":{"$ref":"#/$defs/month"}},
    "recommendationEligible": {"type":"boolean"},
    "recommendationHoldReason": {"enum":["persistent-snow","precipitation-validation"]},
    "historicalPeriod":{"type":"object","required":["startYear","endYear","classification"],"properties":{"startYear":{"const":1991},"endYear":{"const":2025},"classification":{"const":"project-defined-historical-climate-average"}},"additionalProperties":false},
    "representativeCell": {"$ref":"#/$defs/representativeCell"},
    "bestMonths": {"type":"array","items":{"type":"integer","minimum":1,"maximum":12},"uniqueItems":true},
    "alternatives": {"type":"array","items":{"$ref":"#/$defs/slug"},"uniqueItems":true},
    "provenance": {"type":"object","additionalProperties":{"type":"string"}},
    "updatedAt": {"type":"string","pattern":"^\\d{4}-\\d{2}-\\d{2}T\\d{2}:\\d{2}:\\d{2}(?:\\.\\d{3})?Z$"}
  },
  "additionalProperties": false,
  "$defs": {
    "slug": {"type":"string","pattern":"^[a-z0-9]+(?:-[a-z0-9]+)*$"},
    "probability": {"type":"number","minimum":0,"maximum":1},
    "score": {"type":"integer","minimum":0,"maximum":100},
    "confidenceLevel": {"enum":["high","moderate","low"]},
    "elevationBand": {"type":"object","required":["id","minM","maxM","weight"],"properties":{"id":{"$ref":"#/$defs/slug"},"minM":{"type":"number"},"maxM":{"type":"number"},"weight":{"type":"number","exclusiveMinimum":0,"maximum":1}},"additionalProperties":false},
    "representativeCell": {"type":"object","required":["lat","lon","modelElevationM"],"properties":{"lat":{"type":"number","minimum":-90,"maximum":90},"lon":{"type":"number","minimum":-180,"maximum":180},"modelElevationM":{"type":"number"},"overrideLabel":{"type":"string","minLength":1},"overrideReason":{"type":"string","minLength":1}},"additionalProperties":false},
    "scoreLevel": {"enum":["excellent","very-good","good","fair","poor"]},
    "nullableScore": {"anyOf":[{"$ref":"#/$defs/score"},{"type":"null"}]},
    "nullableScoreLevel": {"anyOf":[{"$ref":"#/$defs/scoreLevel"},{"type":"null"}]},
    "components": {
      "type":"object", "required":["temperature","precipitation","snow","heatStress","wind","daylight"],
      "properties":{"temperature":{"$ref":"#/$defs/score"},"precipitation":{"$ref":"#/$defs/score"},"snow":{"$ref":"#/$defs/score"},"heatStress":{"$ref":"#/$defs/score"},"wind":{"$ref":"#/$defs/score"},"daylight":{"$ref":"#/$defs/score"}}, "additionalProperties":false
    },
    "metrics": {
      "type":"object",
      "required":["temperatureHikingMeanC","temperatureHikingP10C","temperatureHikingP90C","temperatureUtilitySamplesC","wetDayProbability","heavyRainDayProbability","precipitationMonthlyMeanMm","snowDayProbability","snowDepthMeanOnSnowDaysM","windHikingMeanKmh","highWindHourProbability","severeWindHourProbability","hotDayProbability","severeHotDayProbability","daylightHoursMean","relativeHumidityHikingMeanPct","sampleYearCount","dataCompleteness"],
      "properties": {
        "temperatureHikingMeanC":{"type":"number","minimum":-100,"maximum":70}, "temperatureHikingP10C":{"type":"number","minimum":-100,"maximum":70}, "temperatureHikingP90C":{"type":"number","minimum":-100,"maximum":70},
        "temperatureUtilitySamplesC":{"type":"array","minItems":1,"items":{"type":"number","minimum":-100,"maximum":70}},
        "temperatureUtilityScore":{"type":"number","minimum":0,"maximum":100},
        "wetDayProbability":{"$ref":"#/$defs/probability"}, "heavyRainDayProbability":{"$ref":"#/$defs/probability"}, "precipitationMonthlyMeanMm":{"type":"number","minimum":0},
        "snowDayProbability":{"$ref":"#/$defs/probability"}, "snowDepthMeanOnSnowDaysM":{"type":"number","minimum":0}, "windHikingMeanKmh":{"type":"number","minimum":0},
        "highWindHourProbability":{"$ref":"#/$defs/probability"}, "severeWindHourProbability":{"$ref":"#/$defs/probability"}, "hotDayProbability":{"$ref":"#/$defs/probability"}, "severeHotDayProbability":{"$ref":"#/$defs/probability"},
        "daylightHoursMean":{"type":"number","minimum":0,"maximum":24}, "relativeHumidityHikingMeanPct":{"type":"number","minimum":0,"maximum":100},
        "sampleYearCount":{"type":"integer","minimum":0,"maximum":35}, "dataCompleteness":{"$ref":"#/$defs/probability"}
      }
    },
    "band": {
      "allOf": [
        {"$ref":"#/$defs/metrics"},
        {"type":"object","required":["month","bandId","targetElevationM","meanElevationMismatchM","samplePointCount","samplePointMaxSeparationKm","polygonEquivalentDiameterKm","terrainReliefM","interannualScoreSd","validInterannualYearCount","components","overallScore","scoreLevel"],"properties":{
          "month":{"type":"integer","minimum":1,"maximum":12}, "bandId":{"$ref":"#/$defs/slug"}, "targetElevationM":{"type":"number"}, "meanElevationMismatchM":{"type":"number","minimum":0,"maximum":800},
          "samplePointCount":{"type":"integer","minimum":1}, "samplePointMaxSeparationKm":{"type":"number","minimum":0}, "polygonEquivalentDiameterKm":{"type":"number","minimum":0}, "terrainReliefM":{"type":"number","minimum":0}, "interannualScoreSd":{"type":"number","minimum":0}, "validInterannualYearCount":{"type":"integer","minimum":0,"maximum":35},
          "components":{"anyOf":[{"$ref":"#/$defs/components"},{"type":"null"}]}, "overallScore":{"$ref":"#/$defs/nullableScore"}, "scoreLevel":{"$ref":"#/$defs/nullableScoreLevel"}
        }}
      ],
      "unevaluatedProperties":false
    },
    "month": {
      "type":"object", "required":["month","recommendationEligible","overallScore","scoreLevel","components","metrics","bands","reasons","caveats"],
      "properties": {
        "month":{"type":"integer","minimum":1,"maximum":12}, "recommendationEligible":{"type":"boolean"}, "overallScore":{"$ref":"#/$defs/nullableScore"}, "scoreLevel":{"$ref":"#/$defs/nullableScoreLevel"},
        "components":{"anyOf":[{"$ref":"#/$defs/components"},{"type":"null"}]}, "metrics":{"allOf":[{"$ref":"#/$defs/metrics"}],"unevaluatedProperties":false},
        "bands":{"type":"array","minItems":1,"items":{"$ref":"#/$defs/band"}}, "reasons":{"type":"array","items":{"$ref":"#/$defs/slug"},"uniqueItems":true}, "caveats":{"type":"array","items":{"$ref":"#/$defs/slug"},"uniqueItems":true}
      },
      "additionalProperties":false
    }
  }
}
