{
  "schemaVersion": 1,
  "algorithmVersion": "1.3.0",
  "aggregationPolicyVersion": "observation-validity-v1",
  "datasetStatus": "provisional",
  "id": "sikkim",
  "slug": "sikkim",
  "name": "Sikkim Himalaya",
  "countryCode": "IN",
  "countryName": "India",
  "continent": "asia",
  "region": "himalaya",
  "timezone": "Asia/Kolkata",
  "tags": [
    "high-altitude",
    "forest",
    "trekking"
  ],
  "coordinates": {
    "lat": 27.53,
    "lon": 88.61
  },
  "elevationBands": [
    {
      "id": "representative",
      "minM": 2077,
      "maxM": 2178,
      "weight": 1
    }
  ],
  "elevation": {
    "minM": 2127.3,
    "medianM": 2127.3,
    "maxM": 2127.3
  },
  "months": [
    {
      "month": 1,
      "recommendationEligible": false,
      "overallScore": null,
      "scoreLevel": null,
      "components": null,
      "metrics": {
        "temperatureHikingMeanC": 5.1,
        "temperatureHikingP10C": 1.9,
        "temperatureHikingP90C": 9,
        "wetDayProbability": 0.9512,
        "heavyRainDayProbability": 0.5797,
        "precipitationMonthlyMeanMm": 424.5,
        "snowDayProbability": 0.9972,
        "snowDepthMeanOnSnowDaysM": 0.5,
        "windHikingMeanKmh": 3.3,
        "highWindHourProbability": 0,
        "severeWindHourProbability": 0,
        "hotDayProbability": 0,
        "severeHotDayProbability": 0,
        "daylightHoursMean": 10.6,
        "relativeHumidityHikingMeanPct": 85.2,
        "dataCompleteness": 1,
        "temperatureUtilitySamplesC": [
          5.1
        ],
        "sampleYearCount": 35
      },
      "reasons": [
        "seasonal-tradeoffs"
      ],
      "caveats": [
        "historical-climatology-not-a-forecast",
        "unvalidated-grid-wind",
        "precipitation-validation-review"
      ],
      "bands": [
        {
          "temperatureHikingMeanC": 5.127843097390254,
          "relativeHumidityHikingMeanPct": 85.18856744841867,
          "windHikingMeanKmh": 3.3478012142608704,
          "highWindHourProbability": 0,
          "severeWindHourProbability": 0,
          "hotDayProbability": 0,
          "severeHotDayProbability": 0,
          "snowDayProbability": 0.9972350230414747,
          "wetDayProbability": 0.9511520737327188,
          "heavyRainDayProbability": 0.5797235023041476,
          "precipitationMonthlyMeanMm": 424.48864344577913,
          "snowDepthMeanOnSnowDaysM": 0.5019580431719056,
          "temperatureHikingP10C": 1.9374908085937708,
          "temperatureHikingP90C": 8.98369442187502,
          "temperatureUtilityScore": 60.340595478906344,
          "daylightHoursMean": 10.623071636267406,
          "dataCompleteness": 1,
          "sampleYearCount": 35,
          "month": 1,
          "bandId": "representative",
          "targetElevationM": 2127.3,
          "meanElevationMismatchM": 0,
          "samplePointCount": 1,
          "samplePointMaxSeparationKm": 0,
          "polygonEquivalentDiameterKm": 14.9,
          "terrainReliefM": 0,
          "interannualScoreSd": 3.3682532169424455,
          "validInterannualYearCount": 35,
          "temperatureUtilitySamplesC": [
            5.127843097390254
          ],
          "components": null,
          "overallScore": null,
          "scoreLevel": null
        }
      ]
    },
    {
      "month": 2,
      "recommendationEligible": false,
      "overallScore": null,
      "scoreLevel": null,
      "components": null,
      "metrics": {
        "temperatureHikingMeanC": 5.9,
        "temperatureHikingP10C": 2.6,
        "temperatureHikingP90C": 9.4,
        "wetDayProbability": 0.9695,
        "heavyRainDayProbability": 0.6834,
        "precipitationMonthlyMeanMm": 463.2,
        "snowDayProbability": 0.998,
        "snowDepthMeanOnSnowDaysM": 0.8,
        "windHikingMeanKmh": 3.6,
        "highWindHourProbability": 0,
        "severeWindHourProbability": 0,
        "hotDayProbability": 0,
        "severeHotDayProbability": 0,
        "daylightHoursMean": 11.2,
        "relativeHumidityHikingMeanPct": 86,
        "dataCompleteness": 1,
        "temperatureUtilitySamplesC": [
          5.9
        ],
        "sampleYearCount": 35
      },
      "reasons": [
        "seasonal-tradeoffs"
      ],
      "caveats": [
        "historical-climatology-not-a-forecast",
        "unvalidated-grid-wind",
        "precipitation-validation-review"
      ],
      "bands": [
        {
          "temperatureHikingMeanC": 5.9465354148388885,
          "relativeHumidityHikingMeanPct": 86.0340784826693,
          "windHikingMeanKmh": 3.6181023452384977,
          "highWindHourProbability": 0,
          "severeWindHourProbability": 0,
          "hotDayProbability": 0,
          "severeHotDayProbability": 0,
          "snowDayProbability": 0.9979591836734695,
          "wetDayProbability": 0.9694933145672061,
          "heavyRainDayProbability": 0.6833919774806473,
          "precipitationMonthlyMeanMm": 463.1843297284767,
          "snowDepthMeanOnSnowDaysM": 0.8044147809260473,
          "temperatureHikingP10C": 2.5618194218750205,
          "temperatureHikingP90C": 9.43657528125002,
          "temperatureUtilityScore": 65.2461819805903,
          "daylightHoursMean": 11.222211040679317,
          "dataCompleteness": 1,
          "sampleYearCount": 35,
          "month": 2,
          "bandId": "representative",
          "targetElevationM": 2127.3,
          "meanElevationMismatchM": 0,
          "samplePointCount": 1,
          "samplePointMaxSeparationKm": 0,
          "polygonEquivalentDiameterKm": 14.9,
          "terrainReliefM": 0,
          "interannualScoreSd": 3.7085753037858473,
          "validInterannualYearCount": 35,
          "temperatureUtilitySamplesC": [
            5.9465354148388885
          ],
          "components": null,
          "overallScore": null,
          "scoreLevel": null
        }
      ]
    },
    {
      "month": 3,
      "recommendationEligible": false,
      "overallScore": null,
      "scoreLevel": null,
      "components": null,
      "metrics": {
        "temperatureHikingMeanC": 8.8,
        "temperatureHikingP10C": 5.7,
        "temperatureHikingP90C": 12.1,
        "wetDayProbability": 0.9668,
        "heavyRainDayProbability": 0.6968,
        "precipitationMonthlyMeanMm": 500.2,
        "snowDayProbability": 0.9972,
        "snowDepthMeanOnSnowDaysM": 0.8,
        "windHikingMeanKmh": 3.6,
        "highWindHourProbability": 0,
        "severeWindHourProbability": 0,
        "hotDayProbability": 0,
        "severeHotDayProbability": 0,
        "daylightHoursMean": 12,
        "relativeHumidityHikingMeanPct": 84,
        "dataCompleteness": 1,
        "temperatureUtilitySamplesC": [
          8.8
        ],
        "sampleYearCount": 35
      },
      "reasons": [
        "long-daylight",
        "seasonal-tradeoffs"
      ],
      "caveats": [
        "historical-climatology-not-a-forecast",
        "unvalidated-grid-wind",
        "precipitation-validation-review"
      ],
      "bands": [
        {
          "temperatureHikingMeanC": 8.763214651794735,
          "relativeHumidityHikingMeanPct": 84.0242513253389,
          "windHikingMeanKmh": 3.5712777009625323,
          "highWindHourProbability": 0,
          "severeWindHourProbability": 0,
          "hotDayProbability": 0,
          "severeHotDayProbability": 0,
          "snowDayProbability": 0.9972350230414747,
          "wetDayProbability": 0.9668202764976958,
          "heavyRainDayProbability": 0.6967741935483871,
          "precipitationMonthlyMeanMm": 500.24407134567355,
          "snowDepthMeanOnSnowDaysM": 0.8188246302935805,
          "temperatureHikingP10C": 5.672598230468771,
          "temperatureHikingP90C": 12.09319149218752,
          "temperatureUtilityScore": 80.10506107534012,
          "daylightHoursMean": 12.00184544662467,
          "dataCompleteness": 1,
          "sampleYearCount": 35,
          "month": 3,
          "bandId": "representative",
          "targetElevationM": 2127.3,
          "meanElevationMismatchM": 0,
          "samplePointCount": 1,
          "samplePointMaxSeparationKm": 0,
          "polygonEquivalentDiameterKm": 14.9,
          "terrainReliefM": 0,
          "interannualScoreSd": 1.9807764967357995,
          "validInterannualYearCount": 35,
          "temperatureUtilitySamplesC": [
            8.763214651794735
          ],
          "components": null,
          "overallScore": null,
          "scoreLevel": null
        }
      ]
    },
    {
      "month": 4,
      "recommendationEligible": false,
      "overallScore": null,
      "scoreLevel": null,
      "components": null,
      "metrics": {
        "temperatureHikingMeanC": 12.1,
        "temperatureHikingP10C": 9.2,
        "temperatureHikingP90C": 15.2,
        "wetDayProbability": 0.9781,
        "heavyRainDayProbability": 0.4857,
        "precipitationMonthlyMeanMm": 376.3,
        "snowDayProbability": 0.9371,
        "snowDepthMeanOnSnowDaysM": 0.4,
        "windHikingMeanKmh": 3.3,
        "highWindHourProbability": 0,
        "severeWindHourProbability": 0,
        "hotDayProbability": 0,
        "severeHotDayProbability": 0,
        "daylightHoursMean": 12.8,
        "relativeHumidityHikingMeanPct": 81.9,
        "dataCompleteness": 1,
        "temperatureUtilitySamplesC": [
          12.1
        ],
        "sampleYearCount": 35
      },
      "reasons": [
        "comfortable-temperatures",
        "long-daylight"
      ],
      "caveats": [
        "historical-climatology-not-a-forecast",
        "unvalidated-grid-wind",
        "precipitation-validation-review"
      ],
      "bands": [
        {
          "temperatureHikingMeanC": 12.091151174107162,
          "relativeHumidityHikingMeanPct": 81.88455291256925,
          "windHikingMeanKmh": 3.344769350288172,
          "highWindHourProbability": 0,
          "severeWindHourProbability": 0,
          "hotDayProbability": 0,
          "severeHotDayProbability": 0,
          "snowDayProbability": 0.937142857142857,